{
  "pack": "PACK_A",
  "coder_id": "A_SOL_01",
  "coder_family": "Hermes-Sol",
  "instruction_version": "20260831-v1",
  "independent": true,
  "key_access": false,
  "source_path": "experiments/pressure_category/coderpacks_belief1/PACK_A_final.md",
  "source_sha256": "05eb98982dea1c3b4087f07fc5d96b7df0d3f8f524227dedfa5942784da4a9ec",
  "assigned_ids": [
    "A-01",
    "A-02",
    "A-03",
    "A-04",
    "A-05",
    "A-06",
    "A-07",
    "A-08",
    "A-09",
    "A-10",
    "A-11",
    "A-12",
    "A-13",
    "A-14",
    "A-15",
    "A-16",
    "A-17",
    "A-18",
    "A-19",
    "A-20",
    "A-21",
    "A-22",
    "A-23",
    "A-24",
    "A-25",
    "A-26",
    "A-27",
    "A-28",
    "A-29",
    "A-30",
    "A-31",
    "A-32",
    "A-33",
    "A-34",
    "A-35",
    "A-36",
    "A-37",
    "A-38",
    "A-39",
    "A-40",
    "A-41",
    "A-42",
    "A-43",
    "A-44",
    "A-45",
    "A-46",
    "A-47",
    "A-48",
    "A-49",
    "A-50",
    "A-51",
    "A-52",
    "A-53",
    "A-54",
    "A-55",
    "A-56",
    "A-57",
    "A-58",
    "A-59",
    "A-60",
    "A-61",
    "A-62",
    "A-63",
    "A-64",
    "A-65",
    "A-66"
  ],
  "notes": "Independent blind semantic coding of PACK_A only.",
  "items": [
    {
      "id": "A-01",
      "q1_orientation": "정한 것 지킴",
      "q2_politics": "우파",
      "q3_beliefs": [
        8
      ],
      "evidence": {
        "q1": "한 번 정한 결정을 지켜내면서 어려움을 견디는 경험",
        "q2": "한 번 정한 결정을 지켜내면서 어려움을 견디는 경험",
        "q3": {
          "8": "한 번 정한 결정을 지켜내면서"
        }
      },
      "confidence": {
        "q1": 0.96,
        "q2": 0.76,
        "q3": 0.95
      },
      "ambiguity_note": null
    },
    {
      "id": "A-02",
      "q1_orientation": "정한 것 지킴",
      "q2_politics": "우파",
      "q3_beliefs": [
        7,
        8,
        12
      ],
      "evidence": {
        "q1": "일관성의 원칙",
        "q2": "같은 경우를 같게 다루고",
        "q3": {
          "7": "같은 경우를 같게 다루고",
          "8": "한 번 정한 것을 지키는 것",
          "12": "선례를 남기게 됩니다"
        }
      },
      "confidence": {
        "q1": 0.99,
        "q2": 0.88,
        "q3": 0.99
      },
      "ambiguity_note": null
    },
    {
      "id": "A-03",
      "q1_orientation": "정한 것 지킴",
      "q2_politics": "우파",
      "q3_beliefs": [
        3,
        8,
        11,
        12
      ],
      "evidence": {
        "q1": "한 번 정한 기준을 쉽게 흔들면",
        "q2": "한 번 정한 기준을 쉽게 흔들면",
        "q3": {
          "3": "먼저 현 원이 실질적으로 아이를 돕고 있는지 확인",
          "8": "한 번 정한 기준을 쉽게 흔들면",
          "11": "먼저 현 원이 실질적으로 아이를 돕고 있는지 확인하는 것이 순서",
          "12": "앞으로의 선례가 되어 버립니다"
        }
      },
      "confidence": {
        "q1": 0.91,
        "q2": 0.72,
        "q3": 0.92
      },
      "ambiguity_note": null
    },
    {
      "id": "A-04",
      "q1_orientation": "정한 것 지킴",
      "q2_politics": "우파",
      "q3_beliefs": [
        7,
        8,
        10,
        12
      ],
      "evidence": {
        "q1": "개별 동정심이나 더 좋은 결과의 가능성이 아니라",
        "q2": "같은 경우는 같게 다루는 것",
        "q3": {
          "7": "같은 경우는 같게 다루는 것",
          "8": "한 번 정한 것은 지켜질 때",
          "10": "이 동물만을 위한 특별한 길이 다른 모든 동물에게 진 빚",
          "12": "오늘의 편의는 내일의 선례"
        }
      },
      "confidence": {
        "q1": 0.99,
        "q2": 0.91,
        "q3": 0.99
      },
      "ambiguity_note": null
    },
    {
      "id": "A-05",
      "q1_orientation": "사람 사정 먼저",
      "q2_politics": "좌파",
      "q3_beliefs": [
        2,
        5,
        7,
        8
      ],
      "evidence": {
        "q1": "특정 학생의 필요를 구조적으로 배제한다면",
        "q2": "실질적 공정성을 구현하는가",
        "q3": {
          "2": "\"절차 자체\"가 아니라",
          "5": "형식적으로 일관되게 적용하는 것은 오히려 불공정을 강화",
          "7": "유사 사례에 동일하게 적용",
          "8": "한 번 정한 것을 지킨다"
        }
      },
      "confidence": {
        "q1": 0.86,
        "q2": 0.74,
        "q3": 0.87
      },
      "ambiguity_note": null
    },
    {
      "id": "A-06",
      "q1_orientation": "정한 것 지킴",
      "q2_politics": "우파",
      "q3_beliefs": [
        8,
        9,
        12
      ],
      "evidence": {
        "q1": "현재 원을 유지하되",
        "q2": "한 번 정한 것은 지켜질 때 비로소 값이 있다",
        "q3": {
          "8": "한 번 정한 것은 지켜질 때 비로소 값이 있다",
          "9": "받을 몫은 쌓아 온 기여에서 나온다",
          "12": "어려움이 생기면 바꾼다\"는 선례"
        }
      },
      "confidence": {
        "q1": 0.97,
        "q2": 0.84,
        "q3": 0.98
      },
      "ambiguity_note": null
    },
    {
      "id": "A-07",
      "q1_orientation": "정한 것 지킴",
      "q2_politics": "우파",
      "q3_beliefs": [
        3,
        7,
        10,
        12
      ],
      "evidence": {
        "q1": "표준 절차로 처리하는 것이 옳습니다",
        "q2": "동일한 사안이 학생마다 다르게 다루어져 공정성이 훼손",
        "q3": {
          "3": "학생의 사정을 성실히 듣고",
          "7": "동일한 사안이 학생마다 다르게 다루어져",
          "10": "한 학생만을 위한 특별한 길",
          "12": "오늘의 예외가 내일의 선례"
        }
      },
      "confidence": {
        "q1": 0.98,
        "q2": 0.87,
        "q3": 0.97
      },
      "ambiguity_note": null
    },
    {
      "id": "A-08",
      "q1_orientation": "정한 것 지킴",
      "q2_politics": "우파",
      "q3_beliefs": [
        7,
        8,
        9,
        11,
        12
      ],
      "evidence": {
        "q1": "기존 체계를 존중하는 것",
        "q2": "같은 경우는 같게 다루는",
        "q3": {
          "7": "같은 경우는 같게 다루는",
          "8": "기존 책임 범위를 존중",
          "9": "받을 몫은 기여에서 나온다",
          "11": "결정은 순서와 방식을 밟아",
          "12": "한 번의 예외가 내일의 선례"
        }
      },
      "confidence": {
        "q1": 0.98,
        "q2": 0.88,
        "q3": 0.96
      },
      "ambiguity_note": null
    },
    {
      "id": "A-09",
      "q1_orientation": "정한 것 지킴",
      "q2_politics": "우파",
      "q3_beliefs": [
        7,
        8,
        9
      ],
      "evidence": {
        "q1": "객관적 기준으로 다른 업무팀이 우위에 있다면",
        "q2": "받을 몫은 쌓아 온 기여에서 나온다",
        "q3": {
          "7": "같은 상황에 같은 기준",
          "8": "한 번 정한 것은 지켜질 때 비로소 값이 있다",
          "9": "받을 몫은 쌓아 온 기여에서 나온다"
        }
      },
      "confidence": {
        "q1": 0.88,
        "q2": 0.8,
        "q3": 0.98
      },
      "ambiguity_note": null
    },
    {
      "id": "A-10",
      "q1_orientation": "정한 것 지킴",
      "q2_politics": "우파",
      "q3_beliefs": [
        7,
        8,
        10,
        12
      ],
      "evidence": {
        "q1": "확립된 기준을 따라야",
        "q2": "한 사람의 사정으로 기준을 바꾸면",
        "q3": {
          "7": "모든 유사 사례에서 같은 요구",
          "8": "정한 원칙을 일관되게 준수",
          "10": "한 사람의 사정으로 기준을 바꾸면",
          "12": "오늘의 예외가 내일의 선례"
        }
      },
      "confidence": {
        "q1": 0.98,
        "q2": 0.86,
        "q3": 0.96
      },
      "ambiguity_note": null
    },
    {
      "id": "A-11",
      "q1_orientation": "정한 것 지킴",
      "q2_politics": "우파",
      "q3_beliefs": [
        7,
        8,
        10,
        12
      ],
      "evidence": {
        "q1": "기밀성이라는 약속을 진정으로 지킬 수 있는 방식",
        "q2": "같은 경우는 같게 다루는 것",
        "q3": {
          "7": "모든 직원에게 일관되게 적용",
          "8": "한 번 정한 것은 지켜질 때 값이 있다",
          "10": "한 사람을 위한 특별한 길이 아닌",
          "12": "오늘 지켜진 원칙이 내일의 선례"
        }
      },
      "confidence": {
        "q1": 0.9,
        "q2": 0.79,
        "q3": 0.97
      },
      "ambiguity_note": null
    },
    {
      "id": "A-12",
      "q1_orientation": "정한 것 지킴",
      "q2_politics": "우파",
      "q3_beliefs": [
        7,
        8,
        10,
        12
      ],
      "evidence": {
        "q1": "한 번 정한 규칙을 지켜야",
        "q2": "다수 주민의 피해를 개인의 편의보다 우선",
        "q3": {
          "7": "모두를 배려하는 결정",
          "8": "한 번 정한 규칙을 지켜야",
          "10": "특정 개인만을 위한 특별한 길이 아닌",
          "12": "오늘의 예외가 내일의 관례"
        }
      },
      "confidence": {
        "q1": 0.95,
        "q2": 0.79,
        "q3": 0.95
      },
      "ambiguity_note": null
    },
    {
      "id": "A-13",
      "q1_orientation": "정한 것 지킴",
      "q2_politics": "우파",
      "q3_beliefs": [
        7,
        8,
        9,
        12
      ],
      "evidence": {
        "q1": "원래 업무팀으로의 복귀를 권장",
        "q2": "동일한 상황의 팀원들에게 공평",
        "q3": {
          "7": "동일한 상황의 팀원들에게 공평",
          "8": "기준을 지키는 것 자체가 신뢰의 기초",
          "9": "휴직 전 높은 평가를 받던 업무로 돌아가는 것",
          "12": "오늘의 편의가 내일의 선례"
        }
      },
      "confidence": {
        "q1": 0.98,
        "q2": 0.87,
        "q3": 0.94
      },
      "ambiguity_note": null
    },
    {
      "id": "A-14",
      "q1_orientation": "정한 것 지킴",
      "q2_politics": "우파",
      "q3_beliefs": [
        7,
        8,
        10,
        11
      ],
      "evidence": {
        "q1": "결정 과정의 정당성과 절차적 엄격함",
        "q2": "일부의 편의를 위해 규칙을 바꾸는 것",
        "q3": {
          "7": "같은 경우는 같게",
          "8": "한 번 정한 것은 지켜질 때 비로소 값이 있다",
          "10": "한 사람만을 위한 특별한 길은 나머지 모두에게 진 빚",
          "11": "결정은 순서와 방식을 밟아"
        }
      },
      "confidence": {
        "q1": 0.97,
        "q2": 0.85,
        "q3": 0.98
      },
      "ambiguity_note": null
    },
    {
      "id": "A-15",
      "q1_orientation": "정한 것 지킴",
      "q2_politics": "우파",
      "q3_beliefs": [
        3,
        7,
        11,
        12
      ],
      "evidence": {
        "q1": "객관적 기준을 먼저 수립한 뒤",
        "q2": "개별 동물을 위한 예외적 결정은 피하고",
        "q3": {
          "3": "먼저 보호소가 과거 유사한 상황에서 어떻게 처리해왔는지",
          "7": "모든 동물에게 공평하게 적용",
          "11": "객관적 기준을 먼저 수립한 뒤",
          "12": "오늘 한 동물을 위해 내린 예외가 내일의 표준"
        }
      },
      "confidence": {
        "q1": 0.95,
        "q2": 0.85,
        "q3": 0.95
      },
      "ambiguity_note": null
    },
    {
      "id": "A-16",
      "q1_orientation": "사람 사정 먼저",
      "q2_politics": "좌파",
      "q3_beliefs": [
        1,
        2,
        3,
        9,
        11,
        12
      ],
      "evidence": {
        "q1": "각자의 사정을 존중하는 더 공정한 방식",
        "q2": "인간관계를 경시하는 결과",
        "q3": {
          "1": "그들의 개별 상황을 무시하는 결과",
          "2": "관계 기반의 방문은 각자의 사정을 존중",
          "3": "당사자와 지역사회와의 협의를 통해",
          "9": "자원봉사자들의 헌신을 인정",
          "11": "결정하는 과정 자체가 중요",
          "12": "향후 모든 지원 사업에서 비용과 효율만을 추구하는 선례"
        }